name,artist,gender,lyrics
Cash In Cash Out,Pharrell Williams,0,"112 ContributorsStraight up


Cash in, cash out, cash in, cash out
Cash in, cash out, cash in, cash out
Cash out, cash out, cash out, cash out
Cash out, cash out, cash out, cash out
Cash in, cash out, cash in, cash out
Cash in, cash out, cash in, cash out
Cash out, cash out, cash out, cash out (21)


Ridin' in the car with no keys (Straight up)
Louis V shirt with no sleeves (On God)
Slaughter Gang, nigga, I'm reppin' (21)
Chopper get to preachin', I'm the reverend (21)
Call him New Era, he cappin' (Yeah)
Them the type of niggas I ain't dappin' (On God)
When I book a show, make my backend cashin'
21, Uncle Sam, dawg, I'm taxin'
Ridin' in the coupe and it's a sport (Yeah)
My bodyguard look like a horse (Straight up)
She gon' suck me up like it's a chore (On God)
Took the LaFerrari on a tour (21)
Buy a Richard Mill' when I get bored (Bored)
Put my sidepiece inside a Porsche (A Porschе)
Money turned me into an assholе
I ain't gon' lie, I was used to being poor (21)
I put Chanel on my feet (And what?)
European model got Chanel on my seats
Put me in a third world country in the middle of the slums
I'ma turn it to a million dollar street (On God)
Pharrell made this so it's a million dollar beat (Straight up)
V12, VVS, I fell in love with Vs (Straight up)
Walk in your section, you ain't reppin' 'bout nothin'
My invoice gon' be a million dollar fee (On God)
Hop in a Bentley and slide (And what?)
Reach for my chain and you die (Say what?)
You know my method, I'ma turn your shirt red, man
Then send your ass how high (On God)
Mama got a Benz, she smiled (21)
Then she got a house, she cried (21)
Nigga took the stand, he lied
Held court in the streets and they gave his ass life (Goddamn)
I'm gettin' bigger and bigger (And what?)
Your pockets littler than little (21)
Put a hundred bands on your head
Now they jumpin' up and down playin' monkey in the middle
She swallow all my kids, she a bad babysitter
Kim Jong-Un, in my pants it's a missile
Friend of the family, I hit all the sisters
The mama love me so she hid all my pistols (Straight up)
You might also like
Cash in, cash out, cash in, cash out
Cash in, cash out, cash in, cash out
Cash out, cash out, cash out, cash out
Cash out, cash out, cash out, cash out
Cash in, cash out, cash in, cash out
Cash in, cash out, cash in, cash out (It's Bunnyhop, nigga)
Cash out, cash out, cash out, cash out (Let me tell these niggas real quick)


Nah, I ain't heard of that, I hit the beach in a furry hat
She got a guy but she purrin' back, I'm lookin' like, ""Where he at?""
Nigga, get out the way (Way), that girl my bae (Hey)
Rock on my hand, nah, this ain't Dwayne (Hey, hey)
This shit neon yellow like pee on it (Hey, hey)
Goin' both sides, yeah, you could say I'm B-I (Hey, hey)
Got whips like slaves, the garage like, ""Yee-haw""
Horses, more car keys than a piano
One came with an umbrella like Rihanna
Nigga, let's be honest (Umm), be honest
Track needed life, nigga, so they put me on it (Yeah, yeah)
Nigga, you don't be on what we on, and 2-1 got three Ks (Yeah)
I think he just might put a sheet on it (Yeah, yeah)
Ice so white, motherfucker, you could ski on it (Switch it up)
Look, any stone I'm in, no less than six digits (Yo, what up, stoner?)
Beep go the Rolls, right-side, I sit in it (Come on, man)
Tick go the watch, it came with a dent in it (Come again)
And skrrt on a plane, just me and my bitch in it (Yo)
(They was talkin' 'bout a hundred million, baby)
Just know it's big business
Hands stay full with them racks like hit tennis (Woo)
And no money, phone account, go get interest
Ah (Ah), you got that backend from the backdoor
I got offered two-point-five for the last show (Last show, nigga)
I declined 'cause the stage didn't match my ethos
Hmm, they know that I'm sick with it
Look, player, what you wan' do? (Ooh)
Me, I don't like violence, but the guns do (Ooh)
'Cause that guerilla right there, he gon' hunt you (Ooh)
While me and my bitch countin' stars out the sunroof (Ooh)
And if you wanna flick up, I don't want to (Ooh)
And if you say ""No cap"", I ain't trust you (Ooh)
Nigga, I'm the headline, you a plus one (Ooh)
I got some brand new thoughts and a new silk scarf
And my bitch do too (Too)
Double R talk and I got like two (Two)
Turbo on that bitch and it hit like zoom (Zoom)
In the mirror, who that nigga? I'm like, ""You"" (You)
Any time I do something, motherfuckers like, ""Oof, oof""

Cash in, cash out, cash in, cash out
Cash in, cash out, cash in, cash out (Bunnyhop, bitch)
Cash out, cash out, cash out, cash out (Baudelaire, stop fuckin' playin' with me)
Cash out, cash out, cash out, cash out (I'll buy one of you niggas)
Cash in, cash out, cash in, cash out
Cash in, cash out, cash in, cash out
Cash out, cash out, cash out, cash out (21, 21)18Embed"
We Found Love,Rihanna,1,"72 Lyrics[Video Intro: Agyness Deyn]
It's like you're screaming, and no one can hear
You almost feel ashamed, that someone could be that important
That without them, you feel like nothing
No one will ever understand how much it hurts
You feel hopeless, like nothing can save you
And when it's over and it's gone
You almost wish you could have all that bad stuff back
So that you could have the good

[Verse 1]
Yellow diamonds in the light
And we're standing side by side
As your shadow crosses mine
What it takes to come alive

[Pre-Chorus]
It's the way I'm feeling, I just can't deny
But I've gotta let it go

[Chorus]
We found love in a hopeless place
We found love in a hopeless place
We found love in a hopeless place
We found love in a hopeless place
You might also like[Drop]

[Verse 2]
Shine a light through an open door
Love and life, I will divide
Turn away 'cause I need you more
Feel the heartbeat in my mind

[Pre-Chorus]
It's the way I'm feeling, I just can't deny
But I've gotta let it go

[Chorus]
We found love in a hopeless place
We found love in a hopeless place
We found love in a hopeless place
We found love in a hopeless place

[Bridge]
Yellow diamonds in the light
And we're standing side by side
As your shadow crosses mine

[Chorus]
We found love in a hopeless place
We found love in a hopeless place
We found love in a hopeless place
We found love in a hopeless place
[Drop]

[Chorus]
We found love in a hopeless place
We found love in a hopeless place
We found love in a hopeless place
We found love in a hopeless place214Embed"
Only Girl (In The World),Rihanna,1,"90 Lyrics[Intro]
La-la-la-la
La-la-la-la
La-la-la-la (Uh, yeah)
La-la-la-la

[Verse 1]
I want you to love me
Like I'm a hot ride (Uh, yeah)
Be thinking of me (Uh)
Doing what you like (Haha)
So, boy, forget about the world
'Cause it's gon' be me and you tonight (Yeah)
I wanna make you beg for it
Then I'ma make you swallow your pride, oh (Uh, uh)

[Chorus]
Want you to make me feel
Like I'm the only girl in the world
Like I'm the only one that you'll ever love
Like I'm the only one who knows your heart
Only girl in the world
Like I'm the only one that's in command
'Cause I'm the only one who understands
How to make you feel like a man, yeah
Want you to make me feel
Like I'm the only girl in the world
Like I'm the only one that you'll ever love
Like I'm the only one who knows your heart
Only one
You might also like[Verse 2]
Want you to take it (Uh)
Like a thief in the night (Uh)
Hold me like a pillow
Make me feel right (Uh)
Baby, I'll tell you all my secrets that I'm keeping
You can come inside (Yeah)
And when you enter, you ain't leaving
Be my prisoner for the night, oh

[Chorus]
Want you to make me feel
Like I'm the only girl in the world
Like I'm the only one that you'll ever love
Like I'm the only one who knows your heart
Only girl in the world
Like I'm the only one that's in command
'Cause I'm the only one who understands
Like I'm the only one who knows your heart
Only one

[Bridge]
Take me for a ride, ride
Oh, baby, take me high, high
Let me make you rise, rise
Oh, make it last all night, night
Take me for a ride, ride
Oh, baby, take me high, high
Let me make you rise, rise
Make it last all night
[Chorus]
Want you to make me feel
Like I'm the only girl in the world
Like I'm the only one that you'll ever love
Like I'm the only one who knows your heart
Only girl in the world
Like I'm the only one that's in command
'Cause I'm the only one who understands
How to make you feel like a man
Only girl in the world
Girl in the world
Only girl in the world
Girl in the world35Embed"
Love On The Brain,Rihanna,1,"169 Lyrics[Verse 1]
And you got me like, oh
What you want from me? (What you want from me?)
And I tried to buy your pretty heart, but the price too high
Baby, you got me like, oh, mmm
You love when I fall apart (Fall apart)
So you can put me together and throw me against the wall

[Pre-Chorus]
Baby, you got me like, I, woo, I
Don't you stop loving me (Loving me)
Don't quit loving me (Loving me)
Just start loving me, oh (Loving me)

[Chorus]
And, babe, I'm fist-fighting with fire
Just to get close to you
Can we burn something, babe?
And I'll run for miles just to get a taste
Must be love on the brain
That's got me feeling this way (Feeling this way)
It beats me black and blue, but it fucks me so good
And I can't get enough
Must be love on the brain, yeah
And it keeps cursing my name (Cursing my name)
No matter what I do, I'm no good without you
And I can't get enough
Must be love on the brain
You might also like[Verse 2]
Baby, keep loving me
Just love me, yeah
Just love me
All you need to do is love me, yeah
Got me like, ow
I'm tired of being played like a violin
What do I gotta do to get in your motherfuckin' heart?

[Pre-Chorus]
Baby, like, I, woo I
Don't you stop loving me (Loving me)
Don't quit loving me (Loving me)
Just start loving me, ooh (Loving me)

[Chorus]
And, babe, I'm fist-fighting with fire
Just to get close to you
Can we burn something, babe?
And I'll run for miles just to get a taste
Must be love on the brain
That's got me feeling this way (Feeling this way)
It beats me black and blue, but it fucks me so good
And I can't get enough
Must be love on the brain, yeah
And it keeps cursing my name (Cursing my name)
No matter what I do, I'm no good without you
And I can't get enough
Must be love on the brain
[Click here to learn more about the making of ""Love on the Brain""]178Embed"
Umbrella,Rihanna,1,"11 ContributorsRihanna Lyrics
Meine Slut tanzt halbnackt wie Rihanna
Sie poppt den Chris im Club wie Rihanna
Die baddest Bitch im Club wie Rihanna
Sie wirft mit Cash im Club und grabbt den Umbrella
Rihanna, Rihanna, Rihanna, Rihanna
Rihanna, Rihanna, Rihanna, Rihanna, Rihanna, Rihanna
Sie hat den Style wie RiRi
Sie macht sich high wie RiRi
So viele neidische Blicke
Doch jeder hier wär gern eigentlich wie sie
Rihanna, Rihanna, Rihanna, Rihanna
Rihanna, Rihanna, Rihanna, Rihanna, Rihanna, Rihanna


Bad habbits, sex addict, rich as fuck
Sie will den Dick, ich lese es von ihren Lippen ab
Also zieh' sie straight von der Blackstage ins Backstage
Und wir drehen Sextape wie Kim K. und Ray J
Sie hockt auf den Knien, bis sie blau sind
Doch 'ne Bitch kennt kein'n Schmerz
Und guckt dir dabei verliebt in die Augen
Und zieht dann ihren Slip aus, springt auf den Dick drauf
Und ich klatsche die Bitch – Chris Brown
Ist nicht wie jede, nicht wie die anderen Mädels im Club
Rihanna macht knallharte Gangsterrapper zum seelischen Wrack
Yayo-Lines, Grey on Ice, du und ich, black on white, sex all night
Just let me be your Drake tonight
You might also like
Meine Slut tanzt halb nackt wie Rihanna
Sie poppt den Chris im Club wie Rihanna
Die baddest Bitch im Club wie Rihanna
Sie wirft mit Cash im Club und grabbt den Umbrella
Rihanna, Rihanna, Rihanna, Rihanna, Rihanna, Rihanna, Rihanna, Rihanna, Rihanna, Rihanna
Sie hat den Style wie RiRi, sie macht sich high wie RiRi
So viele neidische Blicke, doch jeder hier wär gern eigentlich wie sie
Rihanna, Rihanna, Rihanna, Rihanna, Rihanna, Rihanna, Rihanna, Rihanna, Rihanna, Rihanna


Bad habbits, sex addict, Aroma YSL
Trapqueen und fly as hell, cropped top und high waist pant
Sie ist Gangster und Queen, Mascara von MAC in der Tasche
Und 'ne geladene Mac in der Jacke wie Gangster in Queens
Ihr Dress ist on fleek, Bitch, Basecap von Yeezus
Ich kipp' den Riesling über ihr'n G-String
Die Bitch ist so nice und 'ne Bitch mit Style, keine billige Hure
Doch stellt Dinge mit dir an, die kannst du nicht einmal googlen
Baby, Baby, sie macht die Männer verrückt und die Frauen zu Hater
Baby, baby, sie ist crazy as hell, but I'm down for whatever
Ich hab' null Interesse dich anzubaggern, denn bist du nicht wie Rihanna, hab' ich keine Augen für dich, check das Albumcover


Meine Slut tanzt halb nackt wie Rihanna
Sie poppt den Chris im Club wie Rihanna
Die baddest Bitch im Club wie Rihanna
Sie wirft mit Cash im Club und grabbt den Umbrella
Rihanna, Rihanna, Rihanna, Rihanna, Rihanna, Rihanna, Rihanna, Rihanna, Rihanna, Rihanna
Sie hat den Style wie RiRi, sie macht sich high wie RiRi
So viele neidische Blicke, doch jeder hier wär gern eigentlich wie sie
Rihanna, Rihanna, Rihanna, Rihanna, Rihanna, Rihanna, Rihanna, Rihanna, Rihanna, RihannaEmbed"
Stay,Rihanna,1,"107 Lyrics[Verse 1: Rihanna]
All along, it was a fever
A cold sweat, hot-headed believer
I threw my hands in the air, said, ""Show me something""
He said, ""If you dare, come a little closer""

[Pre-Chorus: Rihanna]
'Round and around and around and around, we go
Oh, now, tell me now, tell me now, tell me now you know

[Chorus: Rihanna]
Not really sure how to feel about it
Something in the way you move
Makes me feel like I can't live without you
It takes me all the way
I want you to stay
[Verse 2: Mikky Ekko]
It's not much of a life you're living
It's not just something you take, it's given

[Pre-Chorus: Mikky Ekko]
'Round and around and around and around, we go
Oh, now, tell me now, tell me now, tell me now you know

[Chorus: Mikky Ekko]
Not really sure how to feel about it
Something in the way you move
Makes me feel like I can't live without you
It takes me all the way
And I want you to stay
You might also like[Bridge: Rihanna, Rihanna & Mikky Ekko, Mikky Ekko]
Ooh
The reason I hold on
Ooh
'Cause I need this hole gone
Well, funny you're the broken one
But I'm the only one who needed saving
'Cause when you never see the light
It's hard to know which one of us is caving

[Chorus: Rihanna, Rihanna & Mikky Ekko]
Not really sure how to feel about it
Something in the way you move
Makes me feel like I can't live without you
It takes me all the way
I want you to stay
Stay

[Outro: Rihanna & Mikky Ekko, Rihanna]
I want you to stay
Ooh219Embed"
S&M,Rihanna,1,"81 Lyrics[Intro: Ester Dean]
Na-na-na, come on
Na-na-na, come on
Na-na-na-na-na, come on
Na-na-na, come on, come on, come on
Na-na-na-na, come on
Na-na-na, come on
Na-na-na-na-na, come on
Na-na-na, come on, come on, come on
Na-na-na-na

[Verse 1: Rihanna]
Feels so good being bad (Oh-oh-oh-oh-oh)
There's no way I'm turning back (Oh-oh-oh-oh-oh)
Now the pain is my pleasure 'cause nothing could measure
(Oh, oh, oh-oh-oh-oh-oh)
Love is great, love is fine (Oh-oh-oh-oh-oh)
Out the box, outta line (Oh-oh-oh-oh-oh)
The affliction of the feeling leaves me wanting more
(Oh, oh, oh-oh-oh-oh-oh)

[Chorus: Rihanna]
'Cause I may be bad, but I'm perfectly good at it
Sex in the air, I don't care, I love the smell of it
Sticks and stones may break my bones
But chains and whips excite me
'Cause I may be bad, but I'm perfectly good at it
Sex in the air, I don't care, I love the smell of it
Sticks and stones may break my bones
But chains and whips excite me
You might also like[Post-Chorus: Rihanna & Ester Dean]
Na-na-na, come on, come on, come on
I like it, like it
Come on, come on, come on
I like it, like it (Na-na-na)
Come on, come on, come on
I like it, like it
Come on, come on, come on
I like it, like it

[Verse 2: Rihanna]
Love is great, love is fine (Oh-oh-oh-oh-oh)
Out the box, outta line (Oh-oh-oh-oh-oh)
The affliction of the feeling leaves me wanting more
(Oh, oh, oh-oh-oh-oh-oh)

[Chorus: Rihanna]
'Cause I may be bad, but I'm perfectly good at it
Sex in the air, I don't care, I love the smell of it
Sticks and stones may break my bones
But chains and whips excite me

[Post-Chorus: Rihanna & Ester Dean]
Na-na-na, come on, come on, come on
I like it, like it
Come on, come on, come on
I like it, like it (Na-na-na)
Come on, come on, come on
I like it, like it
Come on, come on, come on
I like it, like it
[Refrain: Rihanna]
S-S-S and M-M-M
S-S-S and M-M-M

[Bridge: Rihanna]
Oh, I love the feeling you bring to me
Oh, you turn me on
It's exactly what I've been yearning for
Give it to me strong
And meet me in my boudoir
Make my body say, ""Ah-ah-ah""
I like it, like it

[Chorus: Rihanna]
'Cause I may be bad, but I'm perfectly good at it
Sex in the air, I don't care, I love the smell of it
Sticks and stones may break my bones
But chains and whips excite me
'Cause I may be bad, but I'm perfectly good at it
Sex in the air, I don't care, I love the smell of it
Sticks and stones may break my bones
But chains and whips excite me

[Post-Chorus: Rihanna & Ester Dean]
Na-na-na, come on, come on, come on
I like it, like it
Come on, come on, come on
I like it, like it (Na-na-na)
Come on, come on, come on
I like it, like it
Come on, come on, come on
I like it, like it
[Refrain: Rihanna]
S-S-S and M-M-M
S-S-S and M-M-M
S-S-S and M-M-M
S-S-S and M-M-M52Embed"
Don't Stop The Music,Rihanna,1,"56 ContributorsDon’t Stop the Music Lyrics[Intro: Rihanna]
Please don't stop the music (Music, music, music, music)
Please don't stop the music (Music, music, music, music)
Please don't stop the music (Music, music, music, music)
Please don't stop the music (Music, music, music, music)

[Verse 1: Rihanna]
It's gettin' late, I'm makin' my way over to my favorite place
I gotta get my body moving, shake the stress away
I wasn't looking for nobody when you looked my way
Possible candidate, yeah
Who knew that you'd be up in here lookin' like you do?
You're making stayin' over here impossible
Baby, I'ma say your aura is incredible
If you don't have to go, don't

[Pre-Chorus: Rihanna]
Do you know what you started? I just came here to party
But now we're rockin' on the dance floor, actin' naughty
Your hands around my waist, just let the music play
We're hand in hand, chest to chest, and now, we're face to face

[Chorus: Rihanna]
I wanna take you away
Let's escape into the music, DJ, let it play
I just can't refuse it, like the way you do this, keep on rockin' to it
Please don't stop the, please don't stop the music
I wanna take you away (Ah, ah, ah, ah-ah)
Let's escape into the music, DJ, let it play
I just can't refuse it (Ah, ah, ah, ah-ah)
Like the way you do this, keep on rockin' to it
Please don't stop the, please don't stop the, please don't stop the music
You might also like[Verse 2: Rihanna]
Baby, are you ready? 'Cause it's gettin' close
Don't you feel the passion ready to explode?
What goes on between us, no one has to know
This is a private show, oh

[Pre-Chorus: Rihanna]
Do you know what you started? I just came here to party
But now we're rockin' on the dance floor, actin' naughty
Your hands around my waist, just let the music play
We're hand in hand, chest to chest, and now, we're face to face

[Chorus: Rihanna]
I wanna take you away (Ah, ah, ah, ah-ah)
Let's escape into the music, DJ, let it play
I just can't refuse it (Ah, ah, ah, ah-ah)
Like the way you do this, keep on rockin' to it
Please don't stop the, please don't stop the music
I wanna take you away
Let's escape into the music, DJ, let it play
I just can't refuse it, like the way you do this, keep on rockin' to it
Please don't stop the, please don't stop the, please don't stop the music

[Post-Chorus: Michael Jackson & Rihanna, Rihanna]
Mama-say, mama-sa, ma-ma-ko-ssa
Mama-say, mama-sa, ma-ma-ko-ssa
Mama-say, mama-sa, ma-ma-ko-ssa
Mama-say, mama-sa, ma-ma-ko-ssa (Please don't stop the music)
Mama-say, mama-sa, ma-ma-ko-ssa
Mama-say, mama-sa, ma-ma-ko-ssa
Mama-say, mama-sa, ma-ma-ko-ssa
Mama-say, mama-sa, ma-ma-ko-ssa (Please don't stop the music)
[Bridge: Rihanna]
Mama-say, mama-sa, ma-ma-ko-ssa
Mama-say, mama-sa, ma-ma-ko-ssa
Mama-say, mama-sa, ma-ma-ko-ssa
Mama-say, mama-sa, ma-ma-ko-ssa (Please don't stop the music)
Mama-say, mama-sa, ma-ma-ko-ssa
Mama-say, mama-sa, ma-ma-ko-ssa
Mama-say, mama-sa, ma-ma-ko-ssa
Mama-say, mama-sa, ma-ma-ko-ssa

[Chorus: Rihanna]
I wanna take you away (Ah, ah, ah, ah-ah)
Let's escape into the music, DJ, let it play
I just can't refuse it (Ah, ah, ah, ah-ah)
Like the way you do this, keep on rockin' to it
Please don't stop the, please don't stop the music
I wanna take you away (Ah, ah, ah, ah-ah)
Let's escape into the music, DJ, let it play
I just can't refuse it (Ah, ah, ah, ah-ah)
Like the way you do this, keep on rockin' to it
Please don't stop the, please don't stop the, please don't stop the music

[Post-Chorus: Michael Jackson & Rihanna, Rihanna]
Mama-say, mama-sa, ma-ma-ko-ssa
Mama-say, mama-sa, ma-ma-ko-ssa
Mama-say, mama-sa, ma-ma-ko-ssa
Mama-say, mama-sa, ma-ma-ko-ssa (Please don't stop the music)
Mama-say, mama-sa, ma-ma-ko-ssa
Mama-say, mama-sa, ma-ma-ko-ssa
Mama-say, mama-sa, ma-ma-ko-ssa
Mama-say, mama-sa, ma-ma-ko-ssa (Please don't stop the music)
[Outro: Michael Jackson & Rihanna, Rihanna]
Mama-say, mama-sa, ma-ma-ko-ssa
Mama-say, mama-sa, ma-ma-ko-ssa
Mama-say, mama-sa, ma-ma-ko-ssa
Mama-say, mama-sa, ma-ma-ko-ssa (Please don't stop the music)
(Music, music, music, music, music, music, music)29Embed"
Diamonds,Rihanna,1,"128 Lyrics[Intro]
Shine bright like a diamond
Shine bright like a diamond

[Verse 1]
Find light in the beautiful sea, I choose to be happy
You and I, you and I
We're like diamonds in the sky
You're a shooting star I see, a vision of ecstasy
When you hold me, I'm alive
We're like diamonds in the sky

[Pre-Chorus]
I knew that we'd become one right away
Oh, right away
At first sight, I felt the energy of sun rays
I saw the life inside your eyes

[Chorus]
So shine bright, tonight, you and I
We're beautiful, like diamonds in the sky
Eye to eye, so alive
We're beautiful, like diamonds in the sky

[Post-Chorus]
Shine bright like a diamond (Woah)
Shine bright like a diamond (Woah)
Shinin' bright like a diamond
We're beautiful, like diamonds in the sky
Shine bright like a diamond (Woah)
Shine bright like a diamond (Woah)
Shinin' bright like a diamond
We're beautiful, like diamonds in the sky
You might also like[Verse 2]
Palms rise to the universe as we moonshine and molly
Feel the warmth, we'll never die
We're like diamonds in the sky
You're a shooting star I see, a vision of ecstasy
When you hold me, I'm alive
We're like diamonds in the sky

[Pre-Chorus]
At first sight, I felt the energy of sun rays
I saw the life inside your eyes

[Chorus]
So shine bright, tonight, you and I
We're beautiful, like diamonds in the sky
Eye to eye, so alive
We're beautiful, like diamonds in the sky

[Post-Chorus]
Shine bright like a diamond (Woah)
Shine bright like a diamond (Woah)
Shinin' bright like a diamond
We're beautiful, like diamonds in the sky
Shine bright like a diamond (Woah)
Shine bright like a diamond (Woah)
Shinin' bright like a diamond
We're beautiful, like diamonds in the sky
[Bridge]
Shine bright like a diamond
Shine bright like a diamond
Shine bright like a diamond

[Chorus]
So shine bright, tonight, you and I
We're beautiful, like diamonds in the sky
Eye to eye, so alive
We're beautiful, like diamonds in the sky

[Outro]
Shine bright like a diamond (Woah)
Shine bright like a diamond (Woah)
Shine bright like a diamond
Woah-oh, yeah
Shine bright like a diamond (Woah)
Shine bright like a diamond (Woah)
Shine bright like a diamond
Shine bright like a diamond91Embed"
